connector_name,connector_url,type,name,description,attributes
Address Validator,https://www.workato.com/integrations/address-validator,action,Custom action,Custom action in Address Validator (Custom),{}
Address Validator,https://www.workato.com/integrations/address-validator,action,Auto complete address,Auto-Complete address in Address Validator,{}
Address Validator,https://www.workato.com/integrations/address-validator,action,Validate address in bulk,Validate address in bulk in Address Validtor,"{""badge"": ""Bulk""}"
Address Validator,https://www.workato.com/integrations/address-validator,action,Get address by ID,Get address details by ID in Address Validator,{}
Address Validator,https://www.workato.com/integrations/address-validator,action,Validate address,Validate the address in Address Validator,{}
Adeona PIM,https://www.workato.com/integrations/adeona-pim,trigger,New deleted product,New deleted product in Adeona PIM,{}
Adeona PIM,https://www.workato.com/integrations/adeona-pim,trigger,New record,New record in Adeona PIM,{}
Adeona PIM,https://www.workato.com/integrations/adeona-pim,trigger,New record,New record in Adeona PIM,"{""badge"": ""Batch""}"
Adeona PIM,https://www.workato.com/integrations/adeona-pim,trigger,New/updated record,New/updated record in Adeona PIM,{}
Adeona PIM,https://www.workato.com/integrations/adeona-pim,trigger,New/updated record,New/updated record in Adeona PIM,"{""badge"": ""Batch""}"
Adeona PIM,https://www.workato.com/integrations/adeona-pim,action,Custom action,Custom action in Adeona PIM (Custom),{}
Adeona PIM,https://www.workato.com/integrations/adeona-pim,action,Search records using Scroll API,Search  records using Scroll API in Adeona PIM,{}
Adeona PIM,https://www.workato.com/integrations/adeona-pim,action,Create records in batch,Create  record  (batch) in Adeona PIM,"{""badge"": ""Batch""}"
Adeona PIM,https://www.workato.com/integrations/adeona-pim,action,Delete records in batch,Delete  record  (batch) in Adeona PIM,"{""badge"": ""Batch""}"
Adeona PIM,https://www.workato.com/integrations/adeona-pim,action,Update records in batch,Update  record  (batch) in Adeona PIM,"{""badge"": ""Batch""}"
Adeona PIM,https://www.workato.com/integrations/adeona-pim,action,Create record,Create  record  in Adeona PIM,{}
Adeona PIM,https://www.workato.com/integrations/adeona-pim,action,Download file by ID,Download file by ID in Adeona PIM,{}
Adeona PIM,https://www.workato.com/integrations/adeona-pim,action,Finish a job,Finish a job in Adeona PIM,{}
Adeona PIM,https://www.workato.com/integrations/adeona-pim,action,Get record,Get  record  in Adeona PIM,{}
Adeona PIM,https://www.workato.com/integrations/adeona-pim,action,Search records,Search  records  in Adeona PIM,{}
Adeona PIM,https://www.workato.com/integrations/adeona-pim,action,Start a job,Start a job in Adeona PIM,{}
Adeona PIM,https://www.workato.com/integrations/adeona-pim,action,Update record,Update  record  in Adeona PIM,{}
Adeona PIM,https://www.workato.com/integrations/adeona-pim,action,Upload file contents,Upload file contents in Adeona PIM,{}
Adobe Admin,https://www.workato.com/integrations/adobe-admin,trigger,New group or product profile,New group or product profile in Adobe Admin,{}
Adobe Admin,https://www.workato.com/integrations/adobe-admin,trigger,New user,New user in Adobe Admin,{}
Adobe Admin,https://www.workato.com/integrations/adobe-admin,action,Custom action,Custom action in Adobe Admin (Custom),{}
Adobe Admin,https://www.workato.com/integrations/adobe-admin,action,Add product profiles to a group,Add product profiles to a group in Adobe Admin,{}
Adobe Admin,https://www.workato.com/integrations/adobe-admin,action,Assign groups to a user,Assign groups to a user in Adobe Admin,{}
Adobe Admin,https://www.workato.com/integrations/adobe-admin,action,Assign users to a group,Assign users to a group in Adobe Admin,{}
Adobe Admin,https://www.workato.com/integrations/adobe-admin,action,Assign users to a product,Assign users to a product in Adobe Admin,{}
Adobe Admin,https://www.workato.com/integrations/adobe-admin,action,Create enterprise user,Create enterprise user in Adobe Admin,{}
Adobe Admin,https://www.workato.com/integrations/adobe-admin,action,Create federated user,Create federated user in Adobe Admin,{}
Adobe Admin,https://www.workato.com/integrations/adobe-admin,action,Create group,Create group in Adobe Admin,{}
Adobe Admin,https://www.workato.com/integrations/adobe-admin,action,Delete group,Delete group in Adobe Admin,{}
Adobe Admin,https://www.workato.com/integrations/adobe-admin,action,Get product info,Get product info in Adobe Admin,{}
Adobe Admin,https://www.workato.com/integrations/adobe-admin,action,Get user,Get user in Adobe Admin,{}
Adobe Admin,https://www.workato.com/integrations/adobe-admin,action,Invite user,Invite user to organization in Adobe Admin,{}
Adobe Admin,https://www.workato.com/integrations/adobe-admin,action,List groups and product profiles,List groups and product profiles in Adobe Admin,{}
Adobe Admin,https://www.workato.com/integrations/adobe-admin,action,List users,List users in Adobe Admin,{}
Adobe Admin,https://www.workato.com/integrations/adobe-admin,action,List users within group,List users within group in Adobe Admin,{}
Adobe Admin,https://www.workato.com/integrations/adobe-admin,action,Remove product profiles from a Group,Remove product profiles from a group in Adobe Admin,{}
Adobe Admin,https://www.workato.com/integrations/adobe-admin,action,Remove user from organization,Remove user from organization in Adobe Admin,{}
Adobe Admin,https://www.workato.com/integrations/adobe-admin,action,Unassign groups from a user,Unassign groups from a user in Adobe Admin,{}
Adobe Admin,https://www.workato.com/integrations/adobe-admin,action,Unassign users from a group,Unassign users from a group in Adobe Admin,{}
Adobe Admin,https://www.workato.com/integrations/adobe-admin,action,Unassign users from a product,Unassign users from a product in Adobe Admin,{}
Adobe Admin,https://www.workato.com/integrations/adobe-admin,action,Update group,Update group in Adobe Admin,{}
Adobe Admin,https://www.workato.com/integrations/adobe-admin,action,Update user,Update user in Adobe Admin,{}
Adobe Sign,https://www.workato.com/integrations/adobe-sign,trigger,New/updated document,New/updated document  in Adobe Sign,{}
Adobe Sign,https://www.workato.com/integrations/adobe-sign,action,Create record,Create record in Adobe Sign,{}
Adobe Sign,https://www.workato.com/integrations/adobe-sign,action,Custom action,Custom action in Adobe Sign,{}
Adobe Sign,https://www.workato.com/integrations/adobe-sign,action,Get record,Get record in Adobe Sign,{}
Adobe Sign,https://www.workato.com/integrations/adobe-sign,action,Search records,Search records in Adobe Sign,{}
Adobe Sign,https://www.workato.com/integrations/adobe-sign,action,Update record,Update record in Adobe Sign,{}
Adobe Sign,https://www.workato.com/integrations/adobe-sign,action,Upload document,Upload document in Adobe Sign,{}
Adp Wisely,https://www.workato.com/integrations/adp-wisely,action,Custom action,Custom action in ADP Wisely,{}
Adp Wisely,https://www.workato.com/integrations/adp-wisely,action,List organization locations,List Organization locations in ADP Wisely,{}
Adp Wisely,https://www.workato.com/integrations/adp-wisely,action,Search funding accounts,Search Funding accounts in ADP Wisely,{}
Adp Wisely,https://www.workato.com/integrations/adp-wisely,action,Submit Wisely Pay by ADP card enrollment.,Submit Wisely Pay by ADP card enrollment in ADP Wisely,{}
Adp Wisely,https://www.workato.com/integrations/adp-wisely,action,Validate paycard account,Validate Pay card account in ADP Wisely,{}
Adp Workforce Now,https://www.workato.com/integrations/adp-workforce-now,trigger,New event notification,New event notification in ADP Workforce Now (Custom),{}
Adp Workforce Now,https://www.workato.com/integrations/adp-workforce-now,action,Custom action,Custom action in ADP Workforce Now (Custom) (Custom),{}
Adp Workforce Now,https://www.workato.com/integrations/adp-workforce-now,action,Change status of job applicant external screening,"Modify Status of a Job Applicant in ADP Workforce Now
      (Custom)",{}
Adp Workforce Now,https://www.workato.com/integrations/adp-workforce-now,action,Create record,Create record in ADP Workforce Now (Custom),{}
Adp Workforce Now,https://www.workato.com/integrations/adp-workforce-now,action,Delete record,Delete record in ADP Workforce Now (Custom),{}
Adp Workforce Now,https://www.workato.com/integrations/adp-workforce-now,action,Get record details,Get details of specific record in ADP Workforce Now (Custom),{}
Adp Workforce Now,https://www.workato.com/integrations/adp-workforce-now,action,Initiate job applicant external screening,"Initiate External screening of a Job Applicant in ADP Workforce Now
      (Custom)",{}
Adp Workforce Now,https://www.workato.com/integrations/adp-workforce-now,action,List records,List records in ADP Workforce Now (Custom),{}
Adp Workforce Now,https://www.workato.com/integrations/adp-workforce-now,action,Modify entries in a Pay Data batch,"Modify Entries in a Pay Data batch in ADP Workforce Now
      (Custom)",{}
Adp Workforce Now,https://www.workato.com/integrations/adp-workforce-now,action,Onboard employee,"Onboard Employee in
                  ADP Workforce Now (Custom)",{}
Adp Workforce Now,https://www.workato.com/integrations/adp-workforce-now,action,Search records,Search for records in ADP Workforce Now (Custom),{}
Adp Workforce Now,https://www.workato.com/integrations/adp-workforce-now,action,Stop deduction instruction,Stop Deduction instruction in ADP Workforce Now (Custom),{}
Adp Workforce Now,https://www.workato.com/integrations/adp-workforce-now,action,Terminate employee,Terminate Employee in ADP Workforce Now (Custom),{}
Adp Workforce Now,https://www.workato.com/integrations/adp-workforce-now,action,Update record,Update record in ADP Workforce Now (Custom),{}
Adp Workforce Now,https://www.workato.com/integrations/adp-workforce-now,action,Upsert record,Upsert record in ADP Workforce Now (Custom),{}
ADP Workforce Now,https://www.workato.com/integrations/adp-workforce-now,trigger,New event notification,New event notification in ADP Workforce Now (Custom),{}
ADP Workforce Now,https://www.workato.com/integrations/adp-workforce-now,action,Custom action,Custom action in ADP Workforce Now (Custom) (Custom),{}
ADP Workforce Now,https://www.workato.com/integrations/adp-workforce-now,action,Change status of job applicant external screening,"Modify Status of a Job Applicant in ADP Workforce Now
      (Custom)",{}
ADP Workforce Now,https://www.workato.com/integrations/adp-workforce-now,action,Create record,Create record in ADP Workforce Now (Custom),{}
ADP Workforce Now,https://www.workato.com/integrations/adp-workforce-now,action,Delete record,Delete record in ADP Workforce Now (Custom),{}
ADP Workforce Now,https://www.workato.com/integrations/adp-workforce-now,action,Get record details,Get details of specific record in ADP Workforce Now (Custom),{}
ADP Workforce Now,https://www.workato.com/integrations/adp-workforce-now,action,Initiate job applicant external screening,"Initiate External screening of a Job Applicant in ADP Workforce Now
      (Custom)",{}
ADP Workforce Now,https://www.workato.com/integrations/adp-workforce-now,action,List records,List records in ADP Workforce Now (Custom),{}
ADP Workforce Now,https://www.workato.com/integrations/adp-workforce-now,action,Modify entries in a Pay Data batch,"Modify Entries in a Pay Data batch in ADP Workforce Now
      (Custom)",{}
ADP Workforce Now,https://www.workato.com/integrations/adp-workforce-now,action,Onboard employee,"Onboard Employee in
                  ADP Workforce Now (Custom)",{}
ADP Workforce Now,https://www.workato.com/integrations/adp-workforce-now,action,Search records,Search for records in ADP Workforce Now (Custom),{}
ADP Workforce Now,https://www.workato.com/integrations/adp-workforce-now,action,Stop deduction instruction,Stop Deduction instruction in ADP Workforce Now (Custom),{}
ADP Workforce Now,https://www.workato.com/integrations/adp-workforce-now,action,Terminate employee,Terminate Employee in ADP Workforce Now (Custom),{}
ADP Workforce Now,https://www.workato.com/integrations/adp-workforce-now,action,Update record,Update record in ADP Workforce Now (Custom),{}
ADP Workforce Now,https://www.workato.com/integrations/adp-workforce-now,action,Upsert record,Upsert record in ADP Workforce Now (Custom),{}
Adyen,https://www.workato.com/integrations/adyen,action,Custom action,Custom action in  (Custom),{}
Adyen,https://www.workato.com/integrations/adyen,action,Change user status,Change user status         in Adyen,{}
Adyen,https://www.workato.com/integrations/adyen,action,Create user,Create user in Adyen,{}
Adyen,https://www.workato.com/integrations/adyen,action,Get user details,Get user details in Adyen,{}
Adyen,https://www.workato.com/integrations/adyen,action,Search users,Search users in Adyen,{}
Adyen,https://www.workato.com/integrations/adyen,action,Update user,Update user in Adyen,{}
AfterShip,https://www.workato.com/integrations/aftership,action,Create tracking,Create a tracking in Aftership,{}
AfterShip,https://www.workato.com/integrations/aftership,action,Custom action,Custom action in Aftership,{}
AfterShip,https://www.workato.com/integrations/aftership,action,Search tracking,Search tracking in Aftership,{}
Agiloft,https://www.workato.com/integrations/agiloft,trigger,New/updated table event (Webhook),New/updated record in Agiloft,"{""badge"": ""Real-time""}"
Agiloft,https://www.workato.com/integrations/agiloft,trigger,Delete table event (Webhook),Deleted record in Agiloft,"{""badge"": ""Real-time""}"
Agiloft,https://www.workato.com/integrations/agiloft,trigger,New/updated records,New/updated record in Agiloft,{}
Agiloft,https://www.workato.com/integrations/agiloft,action,Create record,Create record in Agiloft,{}
Agiloft,https://www.workato.com/integrations/agiloft,action,Custom action,Custom action in Agiloft,{}
Agiloft,https://www.workato.com/integrations/agiloft,action,Delete record,Delete record in Agiloft,{}
Agiloft,https://www.workato.com/integrations/agiloft,action,Get attachment,Get attachment from record in Agiloft,{}
Agiloft,https://www.workato.com/integrations/agiloft,action,Get metadata,Get metadata in Agiloft  connector,{}
Agiloft,https://www.workato.com/integrations/agiloft,action,Remove attachment,Remove attachment from record in Agiloft,{}
Agiloft,https://www.workato.com/integrations/agiloft,action,Search records,Search records in Agiloft,{}
Agiloft,https://www.workato.com/integrations/agiloft,action,Update record,Update record in Agiloft,{}
Agiloft,https://www.workato.com/integrations/agiloft,action,Upload attachment,Upload attachment into record in Agiloft,{}
Aimtec ClouEDI,https://www.workato.com/integrations/aimtec-clouedi,trigger,New document,New document in Aimtec ClouEDI,"{""badge"": ""Real-time""}"
Aimtec ClouEDI,https://www.workato.com/integrations/aimtec-clouedi,action,Send document,Send document to Aimtec ClouEDI,{}
Airbrake,https://www.workato.com/integrations/airbrake,action,Get project,Get project details in Airbrake,{}
Aircall,https://www.workato.com/integrations/aircall,action,Custom action,Custom action in Aircall (Custom),{}
Aircall,https://www.workato.com/integrations/aircall,action,Add a User in a Team,Add a User in a Team in Aircall,{}
Aircall,https://www.workato.com/integrations/aircall,action,Create a Tag,Create a Tag in Aircall,{}
Aircall,https://www.workato.com/integrations/aircall,action,Create a Team,Create a Team in Aircall,{}
Aircall,https://www.workato.com/integrations/aircall,action,Create a User,Create a User in Aircall,{}
Aircall,https://www.workato.com/integrations/aircall,action,Delete a Tag,Delete a Tag in Aircall,{}
Aircall,https://www.workato.com/integrations/aircall,action,Delete a Team,Delete a Team in Aircall,{}
Aircall,https://www.workato.com/integrations/aircall,action,Delete a User,Delete a User in Aircall,{}
Aircall,https://www.workato.com/integrations/aircall,action,Remove a User from a Team,Remove a User from a Team in Aircall,{}
Aircall,https://www.workato.com/integrations/aircall,action,Retrieve Company information,Retrieve Company information in Aircall,{}
Aircall,https://www.workato.com/integrations/aircall,action,Find User,Find User in Aircall,{}
Aircall,https://www.workato.com/integrations/aircall,action,List all Tags,List all Tags in Aircall,{}
Aircall,https://www.workato.com/integrations/aircall,action,List all Teams,List all Teams in Aircall,{}
Aircall,https://www.workato.com/integrations/aircall,action,List all Users,List all Users in Aircall,{}
Aircall,https://www.workato.com/integrations/aircall,action,Retrieve a Tag.,Retrieve a Tag. in Aircall,{}
Aircall,https://www.workato.com/integrations/aircall,action,Retrieve details of a specific Team.,Retrieve details of a specific Team. in Aircall,{}
Aircall,https://www.workato.com/integrations/aircall,action,Retrieve a User Detail with ID,Retrieve a User Detail with ID in Aircall,{}
Airtable,https://www.workato.com/integrations/airtable,trigger,New/updated record,New or updated record in Airtable,{}
Airtable,https://www.workato.com/integrations/airtable,trigger,New record,New record in Airtable,{}
Airtable,https://www.workato.com/integrations/airtable,action,Custom action,Custom action in Airtable (Custom),{}
Airtable,https://www.workato.com/integrations/airtable,action,Create record,Create record in Airtable,{}
Airtable,https://www.workato.com/integrations/airtable,action,Delete record,Delete record in Airtable,{}
Airtable,https://www.workato.com/integrations/airtable,action,Delete records,Delete multiple records in Airtable,"{""badge"": ""Batch""}"
Airtable,https://www.workato.com/integrations/airtable,action,Get record,Get record in Airtable,{}
Airtable,https://www.workato.com/integrations/airtable,action,List records,List records in Airtable,"{""badge"": ""Batch""}"
Airtable,https://www.workato.com/integrations/airtable,action,Search records,Search records in Airtable,"{""badge"": ""Batch""}"
Airtable,https://www.workato.com/integrations/airtable,action,Update record,Update record in Airtable,{}
Airtable,https://www.workato.com/integrations/airtable,action,Upsert record,Upsert record in Airtable,{}
Airtable,https://www.workato.com/integrations/airtable,action,Upsert records,Upsert multiple records in Airtable,"{""badge"": ""Batch""}"
Akamai EAA,https://www.workato.com/integrations/akamai-eaa,action,Custom action,Custom action in Akamai EAA (Custom),{}
Akamai EAA,https://www.workato.com/integrations/akamai-eaa,action,Block users from accessing an IDP,Block users from accessing an IDP in Akamai EAA,{}
Akamai EAA,https://www.workato.com/integrations/akamai-eaa,action,Create records,Create record in Akamai EAA,"{""badge"": ""Bulk""}"
Akamai EAA,https://www.workato.com/integrations/akamai-eaa,action,Delete records,Delete record in Akamai EAA,"{""badge"": ""Bulk""}"
Akamai EAA,https://www.workato.com/integrations/akamai-eaa,action,Get record details by ID,Get details of specific record in Akamai EAA,{}
Akamai EAA,https://www.workato.com/integrations/akamai-eaa,action,Get user upload status,Get user upload status in Akamai EAA,{}
Akamai EAA,https://www.workato.com/integrations/akamai-eaa,action,List records,List records in Akamai EAA,{}
Akamai EAA,https://www.workato.com/integrations/akamai-eaa,action,Unblock users from accessing an IDP,Unblock users from accessing an IDP in Akamai EAA,{}
Akeneo,https://www.workato.com/integrations/akeneo,trigger,New/updated Product,New/updated products in Akeneo,{}
Akeneo,https://www.workato.com/integrations/akeneo,trigger,New/updated Product,New/updated products in Akeneo,"{""badge"": ""Batch""}"
Akeneo,https://www.workato.com/integrations/akeneo,action,Custom action,Custom action in Akeneo (Custom),{}
Akeneo,https://www.workato.com/integrations/akeneo,action,List records,Get records in Akeneo,{}
Alfresco Content Services,https://www.workato.com/integrations/alfresco-content-services,action,Copy file / folder,Copy file / folder in Alfresco  connector,{}
Alfresco Content Services,https://www.workato.com/integrations/alfresco-content-services,action,Create folder,Create folder in Alfresco  connector,{}
Alfresco Content Services,https://www.workato.com/integrations/alfresco-content-services,action,Create file / folder comment,Create file / folder comment in Alfresco  connector,{}
Alfresco Content Services,https://www.workato.com/integrations/alfresco-content-services,action,Create file / folder shared links,Create file / folder shared links in Alfresco  connector,{}
Alfresco Content Services,https://www.workato.com/integrations/alfresco-content-services,action,Create file / folder tags,Create file / folder tags in Alfresco  connector,{}
Alfresco Content Services,https://www.workato.com/integrations/alfresco-content-services,action,Create zip file,Create zip file in Alfresco  connector,{}
Alfresco Content Services,https://www.workato.com/integrations/alfresco-content-services,action,Delete file / folder,Delete file / folder in Alfresco  connector,{}
Alfresco Content Services,https://www.workato.com/integrations/alfresco-content-services,action,Delete file / folder comment,Delete file / folder comment in Alfresco  connector,{}
Alfresco Content Services,https://www.workato.com/integrations/alfresco-content-services,action,Delete file / folder shared links,Delete file / folder shared links in Alfresco  connector,{}
Alfresco Content Services,https://www.workato.com/integrations/alfresco-content-services,action,Delete file / folder tag,Delete file / folder tag in Alfresco  connector,{}
Alfresco Content Services,https://www.workato.com/integrations/alfresco-content-services,action,Download file,Download file in Alfresco  connector,{}
Alfresco Content Services,https://www.workato.com/integrations/alfresco-content-services,action,Get file rendition,Get file rendition in Alfresco  connector,{}
Alfresco Content Services,https://www.workato.com/integrations/alfresco-content-services,action,Get file renditions,Get file renditions in Alfresco  connector,{}
Alfresco Content Services,https://www.workato.com/integrations/alfresco-content-services,action,Get file version,Get file version in Alfresco  connector,{}
Alfresco Content Services,https://www.workato.com/integrations/alfresco-content-services,action,Get file versions,Get file versions in Alfresco  connector,{}
Alfresco Content Services,https://www.workato.com/integrations/alfresco-content-services,action,Get group,Get group in Alfresco  connector,{}
Alfresco Content Services,https://www.workato.com/integrations/alfresco-content-services,action,Get group members,Get group members in Alfresco  connector,{}
Alfresco Content Services,https://www.workato.com/integrations/alfresco-content-services,action,Get groups,Get groups in Alfresco  connector,{}
Alfresco Content Services,https://www.workato.com/integrations/alfresco-content-services,action,Get file / folder,Get file / folder in Alfresco  connector,{}
Alfresco Content Services,https://www.workato.com/integrations/alfresco-content-services,action,Get site / folder children,Get site / folder children in Alfresco  connector,{}
Alfresco Content Services,https://www.workato.com/integrations/alfresco-content-services,action,Get file / folder comments,Get file / folder comments in Alfresco  connector,{}
Alfresco Content Services,https://www.workato.com/integrations/alfresco-content-services,action,Get file / folder properties,Get file / folder properties in Alfresco  connector,{}
Alfresco Content Services,https://www.workato.com/integrations/alfresco-content-services,action,Get file / folder rating,Get file / folder rating in Alfresco  connector,{}
Alfresco Content Services,https://www.workato.com/integrations/alfresco-content-services,action,Get file / folder Alfresco Share URI,Get file / folder Alfresco Share URI in Alfresco  connector,{}
Alfresco Content Services,https://www.workato.com/integrations/alfresco-content-services,action,Get file / folder shared link,Get file / folder shared link in Alfresco  connector,{}
Alfresco Content Services,https://www.workato.com/integrations/alfresco-content-services,action,Get file / folder shared links,Get file / folder shared links in Alfresco  connector,{}
Alfresco Content Services,https://www.workato.com/integrations/alfresco-content-services,action,Get file / folder tags,Get file / folder tags in Alfresco  connector,{}
Alfresco Content Services,https://www.workato.com/integrations/alfresco-content-services,action,Get repository tag,Get repository tag in Alfresco  connector,{}
Alfresco Content Services,https://www.workato.com/integrations/alfresco-content-services,action,Get repository tags,Get repository tags in Alfresco  connector,{}
Alfresco Content Services,https://www.workato.com/integrations/alfresco-content-services,action,Get site,Get site in Alfresco  connector,{}
Alfresco Content Services,https://www.workato.com/integrations/alfresco-content-services,action,Get site groups,Get site groups in Alfresco  connector,{}
Alfresco Content Services,https://www.workato.com/integrations/alfresco-content-services,action,Get site members,Get site members in Alfresco  connector,{}
Alfresco Content Services,https://www.workato.com/integrations/alfresco-content-services,action,Get sites,Get sites in Alfresco  connector,{}
Alfresco Content Services,https://www.workato.com/integrations/alfresco-content-services,action,Get user,Get user in Alfresco  connector,{}
Alfresco Content Services,https://www.workato.com/integrations/alfresco-content-services,action,Get user groups,Get user groups in Alfresco  connector,{}
