connector_name,connector_url,type,name,description,attributes
Anthology Blackboard,https://www.workato.com/integrations/anthology-blackboard,action,Get Grade Schema,Get Grade Schema in Anthology  blackboard,{}
Anthology Blackboard,https://www.workato.com/integrations/anthology-blackboard,action,Get User Grades,Get User Grades in Anthology  blackboard,{}
Anthology Blackboard,https://www.workato.com/integrations/anthology-blackboard,action,Get Groups,Get Groups in Anthology  blackboard,{}
Anthology Blackboard,https://www.workato.com/integrations/anthology-blackboard,action,Get Group,Get Group in Anthology  blackboard,{}
Anthology Blackboard,https://www.workato.com/integrations/anthology-blackboard,action,Get Group Memberships,Get Group Memberships in Anthology  blackboard,{}
Anthology Blackboard,https://www.workato.com/integrations/anthology-blackboard,action,Get Group Membership,Get Group Membership in Anthology  blackboard,{}
Anthology Blackboard,https://www.workato.com/integrations/anthology-blackboard,action,Get Course Meetings,Get Course Meetings in Anthology  blackboard,{}
Anthology Blackboard,https://www.workato.com/integrations/anthology-blackboard,action,Get Course Meeting,Get Course Meeting in Anthology  blackboard,{}
Anthology Blackboard,https://www.workato.com/integrations/anthology-blackboard,action,Get Attendance Records By Meeting Id,Get Attendance Records By Meeting Id in Anthology  blackboard,{}
Anthology Blackboard,https://www.workato.com/integrations/anthology-blackboard,action,Get Attendance Record,Get Attendance Record in Anthology  blackboard,{}
Anthology Blackboard,https://www.workato.com/integrations/anthology-blackboard,action,Generate Attendance Data Download Url,Generate Attendance Data Download Url in Anthology  blackboard,{}
Anthology Blackboard,https://www.workato.com/integrations/anthology-blackboard,action,Get Attendance Records By User Id,Get Attendance Records By User Id in Anthology  blackboard,{}
Anthology Blackboard,https://www.workato.com/integrations/anthology-blackboard,action,Get Messages,Get Messages in Anthology  blackboard,{}
Anthology Blackboard,https://www.workato.com/integrations/anthology-blackboard,action,Get Message Participants,Get Message Participants in Anthology  blackboard,{}
Anthology Blackboard,https://www.workato.com/integrations/anthology-blackboard,action,Get Folders,Get Folders in Anthology  blackboard,{}
Anthology Blackboard,https://www.workato.com/integrations/anthology-blackboard,action,Get Nodes For Course,Get Nodes For Course in Anthology  blackboard,{}
Anthology Blackboard,https://www.workato.com/integrations/anthology-blackboard,action,Get Review Status By Course Id,Get Review Status By Course Id in Anthology  blackboard,{}
Anthology Blackboard,https://www.workato.com/integrations/anthology-blackboard,action,Get Top Level Course Resources,Get Top Level Course Resources in Anthology  blackboard,{}
Anthology Blackboard,https://www.workato.com/integrations/anthology-blackboard,action,Get Course Resource,Get Course Resource in Anthology  blackboard,{}
Anthology Blackboard,https://www.workato.com/integrations/anthology-blackboard,action,Get Course Resource Children,Get Course Resource Children in Anthology  blackboard,{}
Anthology Blackboard,https://www.workato.com/integrations/anthology-blackboard,action,Get Rubrics,Get Rubrics in Anthology  blackboard,{}
Anthology Blackboard,https://www.workato.com/integrations/anthology-blackboard,action,Get Rubric By Id,Get Rubric By Id in Anthology  blackboard,{}
Anthology Blackboard,https://www.workato.com/integrations/anthology-blackboard,action,Get Rubric Associations,Get Rubric Associations in Anthology  blackboard,{}
Anthology Blackboard,https://www.workato.com/integrations/anthology-blackboard,action,Get Rubric Association By Id,Get Rubric Association By Id in Anthology  blackboard,{}
Anthology Blackboard,https://www.workato.com/integrations/anthology-blackboard,action,Get Rubric Evaluation By Id,Get Rubric Evaluation By Id in Anthology  blackboard,{}
Anthology Blackboard,https://www.workato.com/integrations/anthology-blackboard,action,Get Task,Get Task in Anthology  blackboard,{}
Anthology Blackboard,https://www.workato.com/integrations/anthology-blackboard,action,Get Toc Items,Get Toc Items in Anthology  blackboard,{}
Anthology Blackboard,https://www.workato.com/integrations/anthology-blackboard,action,Get Course Memberships,Get Course Memberships in Anthology  blackboard,{}
Anthology Blackboard,https://www.workato.com/integrations/anthology-blackboard,action,Get Membership,Get Membership in Anthology  blackboard,{}
Anthology Blackboard,https://www.workato.com/integrations/anthology-blackboard,action,Get Data Sources,Get Data Sources in Anthology  blackboard,{}
Anthology Blackboard,https://www.workato.com/integrations/anthology-blackboard,action,Get Data Source,Get Data Source in Anthology  blackboard,{}
Anthology Blackboard,https://www.workato.com/integrations/anthology-blackboard,action,Get Goals,Get Goals in Anthology  blackboard,{}
Anthology Blackboard,https://www.workato.com/integrations/anthology-blackboard,action,Get Goal By Id,Get Goal By Id in Anthology  blackboard,{}
Anthology Blackboard,https://www.workato.com/integrations/anthology-blackboard,action,Get Goal Alignments,Get Goal Alignments in Anthology  blackboard,{}
Anthology Blackboard,https://www.workato.com/integrations/anthology-blackboard,action,Get Children Goals,Get Children Goals in Anthology  blackboard,{}
Anthology Blackboard,https://www.workato.com/integrations/anthology-blackboard,action,Get Goal Sets,Get Goal Sets in Anthology  blackboard,{}
Anthology Blackboard,https://www.workato.com/integrations/anthology-blackboard,action,Get Goal Set By Id,Get Goal Set By Id in Anthology  blackboard,{}
Anthology Blackboard,https://www.workato.com/integrations/anthology-blackboard,action,Get Goal Set Category By Id,Get Goal Set Category By Id in Anthology  blackboard,{}
Anthology Blackboard,https://www.workato.com/integrations/anthology-blackboard,action,Get Goals From Set And Category,Get Goals From Set And Category in Anthology  blackboard,{}
Anthology Blackboard,https://www.workato.com/integrations/anthology-blackboard,action,Get Types,Get Types in Anthology  blackboard,{}
Anthology Blackboard,https://www.workato.com/integrations/anthology-blackboard,action,Get Institution Roles,Get Institution Roles in Anthology  blackboard,{}
Anthology Blackboard,https://www.workato.com/integrations/anthology-blackboard,action,Get Institution Role,Get Institution Role in Anthology  blackboard,{}
Anthology Blackboard,https://www.workato.com/integrations/anthology-blackboard,action,Get Nodes,Get Nodes in Anthology  blackboard,{}
Anthology Blackboard,https://www.workato.com/integrations/anthology-blackboard,action,Get Node,Get Node in Anthology  blackboard,{}
Anthology Blackboard,https://www.workato.com/integrations/anthology-blackboard,action,Get Node Admins,Get Node Admins in Anthology  blackboard,{}
Anthology Blackboard,https://www.workato.com/integrations/anthology-blackboard,action,Get Node Admin,Get Node Admin in Anthology  blackboard,{}
Anthology Blackboard,https://www.workato.com/integrations/anthology-blackboard,action,Get Node Children,Get Node Children in Anthology  blackboard,{}
Anthology Blackboard,https://www.workato.com/integrations/anthology-blackboard,action,Get Node Course Associations,Get Node Course Associations in Anthology  blackboard,{}
Anthology Blackboard,https://www.workato.com/integrations/anthology-blackboard,action,Get Tools,Get Tools in Anthology  blackboard,{}
Anthology Blackboard,https://www.workato.com/integrations/anthology-blackboard,action,Get Node User Associations,Get Node User Associations in Anthology  blackboard,{}
Anthology Blackboard,https://www.workato.com/integrations/anthology-blackboard,action,Get Login As Sessions,Get Login As Sessions in Anthology  blackboard,{}
Anthology Blackboard,https://www.workato.com/integrations/anthology-blackboard,action,Get SIS Logs By Data Set Uid,Get SIS Logs By Data Set Uid in Anthology  blackboard,{}
Anthology Blackboard,https://www.workato.com/integrations/anthology-blackboard,action,Get Domain Configs,Get Domain Configs in Anthology  blackboard,{}
Anthology Blackboard,https://www.workato.com/integrations/anthology-blackboard,action,Get Domain Config,Get Domain Config in Anthology  blackboard,{}
Anthology Blackboard,https://www.workato.com/integrations/anthology-blackboard,action,Get Placements,Get Placements in Anthology  blackboard,{}
Anthology Blackboard,https://www.workato.com/integrations/anthology-blackboard,action,Get Placement,Get Placement in Anthology  blackboard,{}
Anthology Blackboard,https://www.workato.com/integrations/anthology-blackboard,action,Authorization Code,Authorization Code in Anthology  blackboard,{}
Anthology Blackboard,https://www.workato.com/integrations/anthology-blackboard,action,Get Token Info,Get Token Info in Anthology  blackboard,{}
Anthology Blackboard,https://www.workato.com/integrations/anthology-blackboard,action,Get Proctoring Services,Get Proctoring Services in Anthology  blackboard,{}
Anthology Blackboard,https://www.workato.com/integrations/anthology-blackboard,action,Get Proctoring Service,Get Proctoring Service in Anthology  blackboard,{}
Anthology Blackboard,https://www.workato.com/integrations/anthology-blackboard,action,Get Pronouns,Get Pronouns in Anthology  blackboard,{}
Anthology Blackboard,https://www.workato.com/integrations/anthology-blackboard,action,Get Active Sessions,Get Active Sessions in Anthology  blackboard,{}
Anthology Blackboard,https://www.workato.com/integrations/anthology-blackboard,action,Get System Roles,Get System Roles in Anthology  blackboard,{}
Anthology Blackboard,https://www.workato.com/integrations/anthology-blackboard,action,Get System Role,Get System Role in Anthology  blackboard,{}
Anthology Blackboard,https://www.workato.com/integrations/anthology-blackboard,action,Get Info,Get Info in Anthology  blackboard,{}
Anthology Blackboard,https://www.workato.com/integrations/anthology-blackboard,action,Get Policies,Get Policies in Anthology  blackboard,{}
Anthology Blackboard,https://www.workato.com/integrations/anthology-blackboard,action,Get System Task,Get System Task in Anthology  blackboard,{}
Anthology Blackboard,https://www.workato.com/integrations/anthology-blackboard,action,Get Version,Get Version in Anthology  blackboard,{}
Anthology Blackboard,https://www.workato.com/integrations/anthology-blackboard,action,Get Terms,Get Terms in Anthology  blackboard,{}
Anthology Blackboard,https://www.workato.com/integrations/anthology-blackboard,action,Get Term,Get Term in Anthology  blackboard,{}
Anthology Blackboard,https://www.workato.com/integrations/anthology-blackboard,action,Get Settings,Get Settings in Anthology  blackboard,{}
Anthology Blackboard,https://www.workato.com/integrations/anthology-blackboard,action,Get Users,Get Users in Anthology  blackboard,{}
Anthology Blackboard,https://www.workato.com/integrations/anthology-blackboard,action,Get User,Get User in Anthology  blackboard,{}
Anthology Blackboard,https://www.workato.com/integrations/anthology-blackboard,action,Get User Avatar,Get User Avatar in Anthology  blackboard,{}
Anthology Blackboard,https://www.workato.com/integrations/anthology-blackboard,action,Get User Memberships,Get User Memberships in Anthology  blackboard,{}
Anthology Blackboard,https://www.workato.com/integrations/anthology-blackboard,action,Get Nodes For User,Get Nodes For User in Anthology  blackboard,{}
Anthology Blackboard,https://www.workato.com/integrations/anthology-blackboard,action,Get Observees,Get Observees in Anthology  blackboard,{}
Anthology Blackboard,https://www.workato.com/integrations/anthology-blackboard,action,Get Observers,Get Observers in Anthology  blackboard,{}
Anthology Blackboard,https://www.workato.com/integrations/anthology-blackboard,action,Get User Pronunciation Audio,Get User Pronunciation Audio in Anthology  blackboard,{}
Anthology Blackboard,https://www.workato.com/integrations/anthology-blackboard,action,Get Current Active User By Id,Get Current Active User By Id in Anthology  blackboard,{}
Anthology Blackboard,https://www.workato.com/integrations/anthology-blackboard,action,Get Column Grade Last Changed,Get Column Grade Last Changed in Anthology  blackboard,{}
Anthology Blackboard,https://www.workato.com/integrations/anthology-blackboard,action,Get Group Sets,Get Group Sets in Anthology  blackboard,{}
Anthology Blackboard,https://www.workato.com/integrations/anthology-blackboard,action,Get Group Set,Get Group Set in Anthology  blackboard,{}
Anthology Blackboard,https://www.workato.com/integrations/anthology-blackboard,action,Get Group Set Children,Get Group Set Children in Anthology  blackboard,{}
Anthology Blackboard,https://www.workato.com/integrations/anthology-blackboard,action,Update Announcement,Update Announcement in Anthology  blackboard,{}
Anthology Blackboard,https://www.workato.com/integrations/anthology-blackboard,action,Update Calendar Item,Update Calendar Item in Anthology  blackboard,{}
Anthology Blackboard,https://www.workato.com/integrations/anthology-blackboard,action,Update Category,Update Category in Anthology  blackboard,{}
Anthology Blackboard,https://www.workato.com/integrations/anthology-blackboard,action,Update Course,Update Course in Anthology  blackboard,{}
Anthology Blackboard,https://www.workato.com/integrations/anthology-blackboard,action,Update Question,Update Question in Anthology  blackboard,{}
Anthology Blackboard,https://www.workato.com/integrations/anthology-blackboard,action,Update Content,Update Content in Anthology  blackboard,{}
Anthology Blackboard,https://www.workato.com/integrations/anthology-blackboard,action,Update Rule,Update Rule in Anthology  blackboard,{}
Anthology Blackboard,https://www.workato.com/integrations/anthology-blackboard,action,Update Adaptive Release Rule Criterion,Update Adaptive Release Rule Criterion in Anthology  blackboard,{}
Anthology Blackboard,https://www.workato.com/integrations/anthology-blackboard,action,Update Review Status,Update Review Status in Anthology  blackboard,{}
Anthology Blackboard,https://www.workato.com/integrations/anthology-blackboard,action,Update Discussion,Update Discussion in Anthology  blackboard,{}
Anthology Blackboard,https://www.workato.com/integrations/anthology-blackboard,action,Update Message,Update Message in Anthology  blackboard,{}
Anthology Blackboard,https://www.workato.com/integrations/anthology-blackboard,action,Update Grade Column,Update Grade Column in Anthology  blackboard,{}
Anthology Blackboard,https://www.workato.com/integrations/anthology-blackboard,action,Update Column Grade,Update Column Grade in Anthology  blackboard,{}
Anthology Blackboard,https://www.workato.com/integrations/anthology-blackboard,action,Update Grade Notation,Update Grade Notation in Anthology  blackboard,{}
Anthology Blackboard,https://www.workato.com/integrations/anthology-blackboard,action,Update Grading Period,Update Grading Period in Anthology  blackboard,{}
Anthology Blackboard,https://www.workato.com/integrations/anthology-blackboard,action,Update Grade Schema,Update Grade Schema in Anthology  blackboard,{}
Anthology Blackboard,https://www.workato.com/integrations/anthology-blackboard,action,Update Group,Update Group in Anthology  blackboard,{}
Anthology Blackboard,https://www.workato.com/integrations/anthology-blackboard,action,Update Course Meeting,Update Course Meeting in Anthology  blackboard,{}
Anthology Blackboard,https://www.workato.com/integrations/anthology-blackboard,action,Update Attendance Record,Update Attendance Record in Anthology  blackboard,{}
Anthology Blackboard,https://www.workato.com/integrations/anthology-blackboard,action,Update Toc Item,Update Toc Item in Anthology  blackboard,{}
Anthology Blackboard,https://www.workato.com/integrations/anthology-blackboard,action,Update Membership,Update Membership in Anthology  blackboard,{}
Anthology Blackboard,https://www.workato.com/integrations/anthology-blackboard,action,Update Data Source,Update Data Source in Anthology  blackboard,{}
Anthology Blackboard,https://www.workato.com/integrations/anthology-blackboard,action,Update Node,Update Node in Anthology  blackboard,{}
Anthology Blackboard,https://www.workato.com/integrations/anthology-blackboard,action,Update Node Course Association,Update Node Course Association in Anthology  blackboard,{}
Anthology Blackboard,https://www.workato.com/integrations/anthology-blackboard,action,Patch Tool,Patch Tool in Anthology  blackboard,{}
Anthology Blackboard,https://www.workato.com/integrations/anthology-blackboard,action,Update Domain Config,Update Domain Config in Anthology  blackboard,{}
Anthology Blackboard,https://www.workato.com/integrations/anthology-blackboard,action,Update Placement,Update Placement in Anthology  blackboard,{}
Anthology Blackboard,https://www.workato.com/integrations/anthology-blackboard,action,Update Pronoun,Update Pronoun in Anthology  blackboard,{}
Anthology Blackboard,https://www.workato.com/integrations/anthology-blackboard,action,Update Term,Update Term in Anthology  blackboard,{}
Anthology Blackboard,https://www.workato.com/integrations/anthology-blackboard,action,Update User,Update User in Anthology  blackboard,{}
Anthology Blackboard,https://www.workato.com/integrations/anthology-blackboard,action,Update Column Attempt,Update Column Attempt in Anthology  blackboard,{}
Anthology Blackboard,https://www.workato.com/integrations/anthology-blackboard,action,Update Group Set,Update Group Set in Anthology  blackboard,{}
Anthology Blackboard,https://www.workato.com/integrations/anthology-blackboard,action,Create Announcement,Create Announcement in Anthology  blackboard,{}
Anthology Blackboard,https://www.workato.com/integrations/anthology-blackboard,action,Create Calendar Item,Create Calendar Item in Anthology  blackboard,{}
Anthology Blackboard,https://www.workato.com/integrations/anthology-blackboard,action,Create Category,Create Category in Anthology  blackboard,{}
Anthology Blackboard,https://www.workato.com/integrations/anthology-blackboard,action,Create Course,Create Course in Anthology  blackboard,{}
Anthology Blackboard,https://www.workato.com/integrations/anthology-blackboard,action,Create Question,Create Question in Anthology  blackboard,{}
Anthology Blackboard,https://www.workato.com/integrations/anthology-blackboard,action,Create Content,Create Content in Anthology  blackboard,{}
Anthology Blackboard,https://www.workato.com/integrations/anthology-blackboard,action,Create Rule,Create Rule in Anthology  blackboard,{}
Anthology Blackboard,https://www.workato.com/integrations/anthology-blackboard,action,Create Adaptive Release Rule Criteria,Create Adaptive Release Rule Criteria in Anthology  blackboard,{}
Anthology Blackboard,https://www.workato.com/integrations/anthology-blackboard,action,Create File Attachment,Create File Attachment in Anthology  blackboard,{}
Anthology Blackboard,https://www.workato.com/integrations/anthology-blackboard,action,Create Child,Create Child in Anthology  blackboard,{}
Anthology Blackboard,https://www.workato.com/integrations/anthology-blackboard,action,Create Assignment,Create Assignment in Anthology  blackboard,{}
Anthology Blackboard,https://www.workato.com/integrations/anthology-blackboard,action,Copy Course,Copy Course in Anthology  blackboard,{}
Anthology Blackboard,https://www.workato.com/integrations/anthology-blackboard,action,Create Discussion,Create Discussion in Anthology  blackboard,{}
Anthology Blackboard,https://www.workato.com/integrations/anthology-blackboard,action,Create Message,Create Message in Anthology  blackboard,{}
Anthology Blackboard,https://www.workato.com/integrations/anthology-blackboard,action,Create Message Reply,Create Message Reply in Anthology  blackboard,{}
Anthology Blackboard,https://www.workato.com/integrations/anthology-blackboard,action,Attach File,Attach File in Anthology  blackboard,{}
Anthology Blackboard,https://www.workato.com/integrations/anthology-blackboard,action,Create Grade Column,Create Grade Column in Anthology  blackboard,{}
Anthology Blackboard,https://www.workato.com/integrations/anthology-blackboard,action,Create Grade Notation,Create Grade Notation in Anthology  blackboard,{}
Anthology Blackboard,https://www.workato.com/integrations/anthology-blackboard,action,Create Grading Period,Create Grading Period in Anthology  blackboard,{}
Anthology Blackboard,https://www.workato.com/integrations/anthology-blackboard,action,Create Grade Schema,Create Grade Schema in Anthology  blackboard,{}
Anthology Blackboard,https://www.workato.com/integrations/anthology-blackboard,action,Create Group,Create Group in Anthology  blackboard,{}
Anthology Blackboard,https://www.workato.com/integrations/anthology-blackboard,action,Create Course Meeting,Create Course Meeting in Anthology  blackboard,{}
Anthology Blackboard,https://www.workato.com/integrations/anthology-blackboard,action,Create Attendance Record,Create Attendance Record in Anthology  blackboard,{}
Anthology Blackboard,https://www.workato.com/integrations/anthology-blackboard,action,Update Attendance Records,Update Attendance Records in Anthology  blackboard,{}
Anthology Blackboard,https://www.workato.com/integrations/anthology-blackboard,action,Create Data Source,Create Data Source in Anthology  blackboard,{}
Anthology Blackboard,https://www.workato.com/integrations/anthology-blackboard,action,Create Node,Create Node in Anthology  blackboard,{}
Anthology Blackboard,https://www.workato.com/integrations/anthology-blackboard,action,Create Child Node,Create Child Node in Anthology  blackboard,{}
Anthology Blackboard,https://www.workato.com/integrations/anthology-blackboard,action,Create Domain Config,Create Domain Config in Anthology  blackboard,{}
Anthology Blackboard,https://www.workato.com/integrations/anthology-blackboard,action,Create Placement,Create Placement in Anthology  blackboard,{}
Anthology Blackboard,https://www.workato.com/integrations/anthology-blackboard,action,Create Pronoun,Create Pronoun in Anthology  blackboard,{}
Anthology Blackboard,https://www.workato.com/integrations/anthology-blackboard,action,Create Term,Create Term in Anthology  blackboard,{}
Anthology Blackboard,https://www.workato.com/integrations/anthology-blackboard,action,Upload,Upload in Anthology  blackboard,{}
Anthology Blackboard,https://www.workato.com/integrations/anthology-blackboard,action,Create User,Create User in Anthology  blackboard,{}
Anthology Blackboard,https://www.workato.com/integrations/anthology-blackboard,action,Create Column Attempt,Create Column Attempt in Anthology  blackboard,{}
Anthology Blackboard,https://www.workato.com/integrations/anthology-blackboard,action,Create Group Set,Create Group Set in Anthology  blackboard,{}
Anthology Blackboard,https://www.workato.com/integrations/anthology-blackboard,action,Create Group Set Child,Create Group Set Child in Anthology  blackboard,{}
Anthology Blackboard,https://www.workato.com/integrations/anthology-blackboard,action,Create Membership,Create Membership in Anthology  blackboard,{}
Anthology Blackboard,https://www.workato.com/integrations/anthology-blackboard,action,Add Child Course,Add Child Course in Anthology  blackboard,{}
Anthology Blackboard,https://www.workato.com/integrations/anthology-blackboard,action,Set Group Predicate List,Set Group Predicate List in Anthology  blackboard,{}
Anthology Blackboard,https://www.workato.com/integrations/anthology-blackboard,action,Create Group Predicate,Create Group Predicate in Anthology  blackboard,{}
Anthology Blackboard,https://www.workato.com/integrations/anthology-blackboard,action,Set Adaptive Release ACL Users Predicates List,Set Adaptive Release ACL Users Predicates List in Anthology  blackboard,{}
Anthology Blackboard,https://www.workato.com/integrations/anthology-blackboard,action,Create Adaptive Release ACL User Predicate,Create Adaptive Release ACL User Predicate in Anthology  blackboard,{}
Anthology Blackboard,https://www.workato.com/integrations/anthology-blackboard,action,Create Content Group,Create Content Group in Anthology  blackboard,{}
Anthology Blackboard,https://www.workato.com/integrations/anthology-blackboard,action,Create Discussion Group Association,Create Discussion Group Association in Anthology  blackboard,{}
Anthology Blackboard,https://www.workato.com/integrations/anthology-blackboard,action,Create Group Membership,Create Group Membership in Anthology  blackboard,{}
Anthology Blackboard,https://www.workato.com/integrations/anthology-blackboard,action,Set Node Admin Association,Set Node Admin Association in Anthology  blackboard,{}
Anthology Blackboard,https://www.workato.com/integrations/anthology-blackboard,action,Create Node Course Association,Create Node Course Association in Anthology  blackboard,{}
Anthology Blackboard,https://www.workato.com/integrations/anthology-blackboard,action,Create Node User Association,Create Node User Association in Anthology  blackboard,{}
Anthology Blackboard,https://www.workato.com/integrations/anthology-blackboard,action,Create Observer,Create Observer in Anthology  blackboard,{}
Anvyl,https://www.workato.com/integrations/anvyl,trigger,New or updated records,New or updated records in Anvyl,"{""badge"": ""Real-time""}"
Anvyl,https://www.workato.com/integrations/anvyl,action,Bulk Import Records,Bulk Import Records in Anvyl,{}
Anvyl,https://www.workato.com/integrations/anvyl,action,Complete a Task,Complete a Task in Anvyl,{}
Anvyl,https://www.workato.com/integrations/anvyl,action,Confirm Milestone,Confirm Milestone in Anvyl,{}
Anvyl,https://www.workato.com/integrations/anvyl,action,Get (Split) Order Collections,Get (Split) Order Collections in Anvyl,{}
