connector_name,connector_url,type,name,description,attributes
Bitbucket,https://www.workato.com/integrations/bitbucket,action,List comments in an issue,List comments in an issue in Bitbucket,"{""badge"": ""Batch""}"
Bitbucket,https://www.workato.com/integrations/bitbucket,action,Search issues,Search issues in Bitbucket,"{""badge"": ""Batch""}"
Bitbucket,https://www.workato.com/integrations/bitbucket,action,Update issue by ID,Update issue in Bitbucket,{}
Bitlocker,https://www.workato.com/integrations/bitlocker,action,Custom action,Custom action in Bitlocker (Custom),{}
Bitlocker,https://www.workato.com/integrations/bitlocker,action,Get recovery key by recovery key ID in Bitlocker,Get Recovery key in Bitlocker,{}
Bitlocker,https://www.workato.com/integrations/bitlocker,action,Get recovery key by user ID in Bitlocker,Get Recovery keys in Bitlocker,{}
Bitlocker,https://www.workato.com/integrations/bitlocker,action,List user owned devices,List user owned devices in Bitlocker,{}
Biz Gate,https://www.workato.com/integrations/biz-gate,action,BizGate ä¼æ¥­æƒ…å ±ã‚’å–å¾—,Get BizGate ä¼æ¥­ in Biz-Gate,{}
Biz Gate,https://www.workato.com/integrations/biz-gate,action,BizGate éƒ¨ç½²æƒ…å ±ã‚’å–å¾—,Get BizGate éƒ¨ç½² in Biz-Gate,{}
Biz Gate,https://www.workato.com/integrations/biz-gate,action,BizGate ã‚­ãƒ¼ãƒžãƒ³æƒ…å ±ã‚’å–å¾—,Get BizGate ã‚­ãƒ¼ãƒžãƒ³ in Biz-Gate,{}
Biz Gate,https://www.workato.com/integrations/biz-gate,action,BizGate ã‚­ãƒ¼ãƒžãƒ³äººåæƒ…å ±ã‚’å–å¾—,Get BizGate ã‚­ãƒ¼ãƒžãƒ³äººå in Biz-Gate,{}
Biz Gate,https://www.workato.com/integrations/biz-gate,action,BizGate ãƒžãƒ¼ã‚±æƒ…å ±ã‚’å–å¾—,Get BizGate ãƒžãƒ¼ã‚± in Biz-Gate,{}
BlackLine,https://www.workato.com/integrations/blackline,action,Import account assignments,Import account assignments in BlackLine,{}
BlackLine,https://www.workato.com/integrations/blackline,action,Import account balances,Import account balances in BlackLine,{}
BlackLine,https://www.workato.com/integrations/blackline,action,Import account group mappings,Import account group mappings in BlackLine,{}
BlackLine,https://www.workato.com/integrations/blackline,action,Import account group settings,Import account group settings in BlackLine,{}
BlackLine,https://www.workato.com/integrations/blackline,action,Import account settings,Import account settings in BlackLine,{}
BlackLine,https://www.workato.com/integrations/blackline,action,Import bank balances,Import bank balances in BlackLine,{}
BlackLine,https://www.workato.com/integrations/blackline,action,Import budgets,Import budgets in BlackLine,{}
BlackLine,https://www.workato.com/integrations/blackline,action,Import CIM mappings,Import CIM mappings in BlackLine,{}
BlackLine,https://www.workato.com/integrations/blackline,action,Import currency rates,Import currency rates in BlackLine,{}
BlackLine,https://www.workato.com/integrations/blackline,action,Import entities,Import entities in BlackLine,{}
BlackLine,https://www.workato.com/integrations/blackline,action,Import entity types,Import entity types in BlackLine,{}
BlackLine,https://www.workato.com/integrations/blackline,action,Import item detail,Import item detail in BlackLine,{}
BlackLine,https://www.workato.com/integrations/blackline,action,Import multi-currency balances,Import multi-currency balances in BlackLine,{}
BlackLine,https://www.workato.com/integrations/blackline,action,Import subledger balances,Import subledger balances in BlackLine,{}
BlackLine,https://www.workato.com/integrations/blackline,action,Import task dependencies,Import task dependencies in BlackLine,{}
BlackLine,https://www.workato.com/integrations/blackline,action,Import task description,Import task description in BlackLine,{}
BlackLine,https://www.workato.com/integrations/blackline,action,Import tasks,Import tasks in BlackLine,{}
BlackLine,https://www.workato.com/integrations/blackline,action,Import tasks auto-certify completion,Import tasks auto-certify completion in BlackLine,{}
BlackLine,https://www.workato.com/integrations/blackline,action,Import team types,Import team types in BlackLine,{}
BlackLine,https://www.workato.com/integrations/blackline,action,Import teams,Import teams in BlackLine,{}
BlackLine,https://www.workato.com/integrations/blackline,action,Import user entities,Import user entities in BlackLine,{}
BlackLine,https://www.workato.com/integrations/blackline,action,Import user roles,Import user roles in BlackLine,{}
BlackLine,https://www.workato.com/integrations/blackline,action,Import user team assignments,Import user team assignments in BlackLine,{}
BlackLine,https://www.workato.com/integrations/blackline,action,Import users,Import users in BlackLine,{}
BlackLine,https://www.workato.com/integrations/blackline,action,Import variance group mapping,Import variance group mapping in BlackLine,{}
BlackLine,https://www.workato.com/integrations/blackline,action,Import variance group settings,Import variance group settings in BlackLine,{}
BlackLine,https://www.workato.com/integrations/blackline,action,Import variance rules,Import variance rules in BlackLine,{}
BlackLine,https://www.workato.com/integrations/blackline,action,Import variance settings,Import variance settings in BlackLine,{}
BlackLine Reports,https://www.workato.com/integrations/blackline-reports,action,Get report content in CSV,Get report content (CSV) in BlackLine Reports,{}
BlackLine Reports,https://www.workato.com/integrations/blackline-reports,action,List reports,List reports in BlackLine Reports,{}
Bloomfire,https://www.workato.com/integrations/bloomfire,trigger,New Published Contribution,New Contribution in Bloomfire,"{""badge"": ""Real-time""}"
Bloomfire,https://www.workato.com/integrations/bloomfire,action,Create a New Question,Create Question in Bloomfire,{}
Bloomfire,https://www.workato.com/integrations/bloomfire,action,Custom action,Custom action in Bloomfire,{}
Bloomfire,https://www.workato.com/integrations/bloomfire,action,Get Post By ID,Get Post By ID created in Bloomfire,{}
Bloomfire,https://www.workato.com/integrations/bloomfire,action,Get Question By ID,Get Question By ID created in Bloomfire,{}
Bloomfire,https://www.workato.com/integrations/bloomfire,action,Get Related Questions,Get Possible Questions posted in Bloomfire,{}
Bloomfire,https://www.workato.com/integrations/bloomfire,action,Get Search Filters,Get all the Filters you can apply to a Search in Bloomfire,{}
Bloomfire,https://www.workato.com/integrations/bloomfire,action,Get Tags,List All Tags in Bloomfire,{}
Bloomfire,https://www.workato.com/integrations/bloomfire,action,Get Taxonomies,Get Taxonomies created in Bloomfire,{}
Bloomfire,https://www.workato.com/integrations/bloomfire,action,Get Question By User,Get Questionsposted by a user in Bloomfire,{}
Bloomfire,https://www.workato.com/integrations/bloomfire,action,Search for Users,Search for Users in Bloomfire,{}
Bloomfire,https://www.workato.com/integrations/bloomfire,action,List All Users,List All Users By ID created in Bloomfire,{}
Bloomfire,https://www.workato.com/integrations/bloomfire,action,Save Answer,Save Answer related to a Question in Bloomfire,{}
Bloomfire,https://www.workato.com/integrations/bloomfire,action,Search for Content,List All Content in Bloomfire,{}
Bluepoint,https://www.workato.com/integrations/bluepoint,action,Custom action,Custom action in Bluepoint (Custom),{}
Bluepoint,https://www.workato.com/integrations/bluepoint,action,Search records,Search records in Bluepoint,{}
BMC Helix ITSM,https://www.workato.com/integrations/bmc-helix-itsm,trigger,New/updated record,New/updated  record in BMC Helix ITSM,{}
BMC Helix ITSM,https://www.workato.com/integrations/bmc-helix-itsm,action,Custom action,Custom action in  (Custom),{}
BMC Helix ITSM,https://www.workato.com/integrations/bmc-helix-itsm,action,Create record,Create record in BMC Helix ITSM,{}
BMC Helix ITSM,https://www.workato.com/integrations/bmc-helix-itsm,action,Get record details by ID,Get record  in BMC Helix ITSM,{}
BMC Helix ITSM,https://www.workato.com/integrations/bmc-helix-itsm,action,Search records,Search records  in BMC Helix ITSM,{}
BMC Helix ITSM,https://www.workato.com/integrations/bmc-helix-itsm,action,Update record,Update record in BMC Helix ITSM,{}
BMC Innovation Suite,https://www.workato.com/integrations/bmc-innovation-suite,trigger,New or updated case,New or updated case in BMC Innovation Suite,{}
BMC Innovation Suite,https://www.workato.com/integrations/bmc-innovation-suite,action,Get all ticket statuses,Get all ticket statuses in BMC Innovation Suite,{}
BMC Innovation Suite,https://www.workato.com/integrations/bmc-innovation-suite,action,Get case by ID,Get case by ID in BMC Innovation Suite,{}
BMC Innovation Suite,https://www.workato.com/integrations/bmc-innovation-suite,action,Get person by ID,Get person by ID in BMC Innovation Suite,{}
BMC Innovation Suite,https://www.workato.com/integrations/bmc-innovation-suite,action,Get questions by case ID,Get questions by case ID in BMC Innovation Suite,{}
BMC Innovation Suite,https://www.workato.com/integrations/bmc-innovation-suite,action,Get reasons by ticket status ID,Get reasons by ticket status ID in BMC Innovation Suite,{}
BMC Innovation Suite,https://www.workato.com/integrations/bmc-innovation-suite,action,Search case,Search case in BMC Innovation Suite,{}
BMC Innovation Suite,https://www.workato.com/integrations/bmc-innovation-suite,action,Update case,Update case in BMC Innovation Suite,{}
Breeze,https://www.workato.com/integrations/breeze,action,Custom action,Custom action in  (Custom),{}
Breeze,https://www.workato.com/integrations/breeze,action,Create object,Create   object  in Breeze,{}
Breeze,https://www.workato.com/integrations/breeze,action,Get object details by ID,Get details of specific  record  by  ID  in Breeze,{}
Breeze,https://www.workato.com/integrations/breeze,action,List objects,List  objects  in Breeze,{}
Breeze,https://www.workato.com/integrations/breeze,action,Move task (card),Move   task (card)  in Breeze,{}
Breeze,https://www.workato.com/integrations/breeze,action,Update object,Update   object  in Breeze,{}
Brex,https://www.workato.com/integrations/brex,action,List users in Brex,This endpoint lists all users.,{}
Brex,https://www.workato.com/integrations/brex,action,Invite user to Brex,This endpoint invites a new user as an employee.,{}
Brex,https://www.workato.com/integrations/brex,action,Get current user in Brex,This endpoint returns the user associated with the OAuth2 access token. ,{}
Brex,https://www.workato.com/integrations/brex,action,Get user in Brex,This endpoint returns a user by ID. ,{}
Brex,https://www.workato.com/integrations/brex,action,Update user in Brex,This endpoint updates a user. Any parameters not provided will be left unchanged.,{}
Brex,https://www.workato.com/integrations/brex,action,Get limit for the user in Brex,This endpoint gets the monthly limit for the user including the monthly available limit. ,{}
Brex,https://www.workato.com/integrations/brex,action,Set limit for the user in Brex,This endpoint sets the monthly limit for a user. The limit amount must be non-negative.,{}
Brex,https://www.workato.com/integrations/brex,action,List locations in Brex,This endpoint lists all locations.,{}
Brex,https://www.workato.com/integrations/brex,action,Create location in Brex,This endpoint creates a new location.,{}
Brex,https://www.workato.com/integrations/brex,action,Get location in Brex,This endpoint gets a location by ID.,{}
Brex,https://www.workato.com/integrations/brex,action,List departments in Brex,This endpoint lists all departments.,{}
Brex,https://www.workato.com/integrations/brex,action,Create department in Brex,This endpoint creates a new department.,{}
Brex,https://www.workato.com/integrations/brex,action,Get department in Brex,This endpoint gets a department by ID.,{}
Brex,https://www.workato.com/integrations/brex,action,Lists all cards by a user_id in Brex,"Lists all cards by a user_id.
        Only cards with limit_type = CARD have spend_controls.",{}
Brex,https://www.workato.com/integrations/brex,action,Create card in Brex,This endpoint creates a new card.,{}
Brex,https://www.workato.com/integrations/brex,action,Get card in Brex,This endpoint retrieves a card by ID.,{}
Brex,https://www.workato.com/integrations/brex,action,Update card in Brex,This endpoint updates an existing vendor card.,{}
Brex,https://www.workato.com/integrations/brex,action,Lock card in Brex,This endpoint locks an existing card.,{}
Brex,https://www.workato.com/integrations/brex,action,Get card number in Brex,"This endpoint retrieves card number, CVV, and expiration date of a card by ID.",{}
Brex,https://www.workato.com/integrations/brex,action,Terminate card in Brex,This endpoint terminates an existing card.,{}
Brex,https://www.workato.com/integrations/brex,action,Unlock card in Brex,This endpoint unlocks an existing card.,{}
Brex,https://www.workato.com/integrations/brex,action,Get company in Brex,This endpoint returns the company associated with the OAuth2 access token.,{}
Brex,https://www.workato.com/integrations/brex,action,Lists vendors in Brex,"This endpoint lists all existing vendors for an account.
        Takes an optional parameter to match by vendor name.",{}
Brex,https://www.workato.com/integrations/brex,action,Create vendor in Brex,This endpoint creates a new vendor.,{}
Brex,https://www.workato.com/integrations/brex,action,Get vendor in Brex,This endpoint retrieves a vendor by ID.,{}
Brex,https://www.workato.com/integrations/brex,action,Update vendor in Brex,This endpoint updates an existing vendor.,{}
Brex,https://www.workato.com/integrations/brex,action,Delete vendor in Brex,This endpoint deletes an existing vendor.,{}
Brex,https://www.workato.com/integrations/brex,action,Lists transfers in Brex,"This endpoint lists existing transfers for an account
        Currently, the API can only return transfers for the following payment rails: ACH, DOMESTIC_WIRE, CHEQUE, INTERNATIONAL_WIRE",{}
Brex,https://www.workato.com/integrations/brex,action,Create transfer in Brex,This endpoint creates a new transfer.,{}
Brex,https://www.workato.com/integrations/brex,action,Get transfer in Brex,This endpoint retrieves a transfer by ID.,{}
Brex,https://www.workato.com/integrations/brex,action,List transactions for the primary card account in Brex,This endpoint lists all settled transactions for the primary card account.,{}
Brex,https://www.workato.com/integrations/brex,action,List transactions for the selected cash account in Brex,This endpoint lists all transactions for the cash account with the selected ID.,{}
Brex,https://www.workato.com/integrations/brex,action,List card accounts in Brex,This endpoint lists all accounts of card type,{}
Brex,https://www.workato.com/integrations/brex,action,List primary card account statements in Brex,This endpoint lists all finalized statements for the primary card account.,{}
Brex,https://www.workato.com/integrations/brex,action,List cash accounts in Brex,This endpoint lists all the existing cash accounts with their status.,{}
Brex,https://www.workato.com/integrations/brex,action,List cash account statements in Brex,This endpoint lists all finalized statements for the cash account by ID.,{}
Brex,https://www.workato.com/integrations/brex,action,List referrals in Brex,This endpoint lists unexpired referrals.,{}
Brex,https://www.workato.com/integrations/brex,action,Create a referral in Brex,This endpoint creates a referral.,{}
Brex,https://www.workato.com/integrations/brex,action,Get referral by ID in Brex,This endpoint gets a referral by ID.,{}
Brex,https://www.workato.com/integrations/brex,action,Create a new document upload in Brex,This endpoint creates a referral.,{}
BuildingConnected,https://www.workato.com/integrations/buildingconnected,trigger,New or updated contact,New or updated contact  in BuildingConnected,{}
BuildingConnected,https://www.workato.com/integrations/buildingconnected,trigger,Updated opportunity status in BidBoard Pro,Updated opportunity status  in BidBoard Pro,"{""badge"": ""Real-time""}"
BuildingConnected,https://www.workato.com/integrations/buildingconnected,action,Custom action,Custom action in BuildingConnected,{}
BuildingConnected,https://www.workato.com/integrations/buildingconnected,action,Get bidder by ID,Get bidder by ID ,{}
BuildingConnected,https://www.workato.com/integrations/buildingconnected,action,Get bidders for a bid package,Get bidders for a bid package in BuildingConnected,{}
BuildingConnected,https://www.workato.com/integrations/buildingconnected,action,Get contact by ID,Get contact by ID in BuildingConnected,{}
BuildingConnected,https://www.workato.com/integrations/buildingconnected,action,Get contacts,Get contacts in BuildingConnected,{}
BuildingConnected,https://www.workato.com/integrations/buildingconnected,action,Get project by ID,Get project by ID in BuildingConnected,{}
BuildingConnected,https://www.workato.com/integrations/buildingconnected,action,Get projects,Get projects in BuildingConnected,{}
BuildingConnected,https://www.workato.com/integrations/buildingconnected,action,Get qualification submission,Get qualification submission in BuildingConnected,{}
BuildingConnected,https://www.workato.com/integrations/buildingconnected,action,Get qualification form,Get qualification form in BuildingConnected,{}
BuildingConnected,https://www.workato.com/integrations/buildingconnected,action,Get completed TradeTapp qualifications,Get completed TradeTapp qualifications in BuildingConnected,{}
Bynder,https://www.workato.com/integrations/bynder,trigger,New asset,New asset in â€‹Bynder,{}
Bynder,https://www.workato.com/integrations/bynder,trigger,New/updated asset,New/updated asset in â€‹Bynder,{}
Bynder,https://www.workato.com/integrations/bynder,action,Custom action,Custom action in Bynder (Custom),{}
Bynder,https://www.workato.com/integrations/bynder,action,Add assets to collection,Add assets to a collection in Bynder,{}
Bynder,https://www.workato.com/integrations/bynder,action,Add tag to assets,Add a tag to assets in Bynder,{}
Bynder,https://www.workato.com/integrations/bynder,action,Create asset usage,Create asset usage in Bynder,{}
Bynder,https://www.workato.com/integrations/bynder,action,Delete assets from collection,Delete assets from collection in Bynder,{}
Bynder,https://www.workato.com/integrations/bynder,action,Download asset,Download asset in Bynder,{}
Bynder,https://www.workato.com/integrations/bynder,action,Get record details by ID,Get records details by ID in Bynder,{}
Bynder,https://www.workato.com/integrations/bynder,action,List brands,List brands in Bynder,"{""badge"": ""Batch""}"
Bynder,https://www.workato.com/integrations/bynder,action,Retrieve assets in collection,Retrieve asset in collection  in Bynder,"{""badge"": ""Batch""}"
Bynder,https://www.workato.com/integrations/bynder,action,Search records,Search records in Bynder,"{""badge"": ""Batch""}"
Bynder,https://www.workato.com/integrations/bynder,action,Share collection,Share collection  in Bynder,{}
Bynder,https://www.workato.com/integrations/bynder,action,Update record,Update record in Bynder,{}
Bynder,https://www.workato.com/integrations/bynder,action,Upload asset,Upload asset in Bynder,{}
Calendly,https://www.workato.com/integrations/calendly,trigger,New event,New event in Calendly,"{""badge"": ""Real-time""}"
Calendly,https://www.workato.com/integrations/calendly,action,Custom action,Custom action in  (Custom),{}
Calendly,https://www.workato.com/integrations/calendly,action,List event types,List Event types  in Calendly,{}
Campaign Cleaner,https://www.workato.com/integrations/campaign-cleaner,action,Get Campaign List,Get Campaign List in Campaign  cleaner,{}
Campaign Cleaner,https://www.workato.com/integrations/campaign-cleaner,action,Get Credits,Get Credits in Campaign  cleaner,{}
Campaign Cleaner,https://www.workato.com/integrations/campaign-cleaner,action,Delete Campaign,Delete Campaign in Campaign  cleaner,{}
Campaign Cleaner,https://www.workato.com/integrations/campaign-cleaner,action,Get Campaign,Get Campaign in Campaign  cleaner,{}
Campaign Cleaner,https://www.workato.com/integrations/campaign-cleaner,action,Get Campaign Status,Get Campaign Status in Campaign  cleaner,{}
Campaign Cleaner,https://www.workato.com/integrations/campaign-cleaner,action,Send Campaign,Send Campaign in Campaign  cleaner,{}
Campaign Monitor,https://www.workato.com/integrations/campaign-monitor,trigger,New subscriber,New subscriber in Campaign Monitor,{}
Campaign Monitor,https://www.workato.com/integrations/campaign-monitor,action,Add subscriber,Add subscriber in Campaign Monitor,{}
Campaign Monitor,https://www.workato.com/integrations/campaign-monitor,action,Custom action,Custom action in Campaign Monitor,{}
Campaign Monitor,https://www.workato.com/integrations/campaign-monitor,action,Delete subscriber,Delete subscriber in Campaign Monitor,{}
Campaign Monitor,https://www.workato.com/integrations/campaign-monitor,action,Get campaign recipients,Get campaign recipients in Campaign Monitor,{}
Campaign Monitor,https://www.workato.com/integrations/campaign-monitor,action,Get campaign summary,Get campaign summary in Campaign Monitor,{}
Campaign Monitor,https://www.workato.com/integrations/campaign-monitor,action,Get client details,Get client details in Campaign Monitor,{}
Campaign Monitor,https://www.workato.com/integrations/campaign-monitor,action,Get email client usage,Get email client usage in Campaign Monitor,{}
Campaign Monitor,https://www.workato.com/integrations/campaign-monitor,action,Get sent campaigns,Get sent campaigns in Campaign Monitor,{}
Campaign Monitor,https://www.workato.com/integrations/campaign-monitor,action,Get subscriber details,Get subscriber details in Campaign Monitor,{}
Campaign Monitor,https://www.workato.com/integrations/campaign-monitor,action,Unsubscribe subscriber,Unsubscribe subscriber in Campaign Monitor,{}
Campaign Monitor,https://www.workato.com/integrations/campaign-monitor,action,Update subscriber,Update subscriber in Campaign Monitor,{}
Camplife,https://www.workato.com/integrations/camplife,action,Custom action,Custom action in Camplife (Custom),{}
Camplife,https://www.workato.com/integrations/camplife,action,Create record,Create  record  in Camplife,{}
Camplife,https://www.workato.com/integrations/camplife,action,Get record,Get  record  in Camplife,{}
Camplife,https://www.workato.com/integrations/camplife,action,Search records,Search  records  in Camplife,{}
Camplife,https://www.workato.com/integrations/camplife,action,Update record,Update  record  in Camplife,{}
Canva,https://www.workato.com/integrations/canva,trigger,New event,New  event in Canva Connect,"{""badge"": ""Real-time""}"
Canva,https://www.workato.com/integrations/canva,action,Custom action,Custom action in Canva Connect (Custom),{}
Canva,https://www.workato.com/integrations/canva,action,Create design autofill,Create design autofill in Canva Connect,{}
Canva,https://www.workato.com/integrations/canva,action,Create record,Create record in Canva Connect,{}
Canva,https://www.workato.com/integrations/canva,action,Delete record,Delete record  in Canva Connect,{}
Canva,https://www.workato.com/integrations/canva,action,Export a design,Export a design in Canva Connect,{}
Canva,https://www.workato.com/integrations/canva,action,Get record details by ID,Get record  in Canva Connect,{}
Canva,https://www.workato.com/integrations/canva,action,Import a design,Import a design in Canva Connect,{}
Canva,https://www.workato.com/integrations/canva,action,Search records,Search records in Canva Connect,{}
Canva,https://www.workato.com/integrations/canva,action,Update record,Update record in Canva Connect,{}
Canva,https://www.workato.com/integrations/canva,action,Upload asset,Upload asset in Canva Connect,{}
Canvas LMS,https://www.workato.com/integrations/canvas-lms,action,Get Assignments,Get  Course Assignments in Canvas LMS,{}
Canvas LMS,https://www.workato.com/integrations/canvas-lms,action,Get Courses,Get  Course information in Canvas LMS,{}
Canvas LMS,https://www.workato.com/integrations/canvas-lms,action,Get Students,Get  Students List in Canvas LMS,{}
Canvas LMS,https://www.workato.com/integrations/canvas-lms,action,Get Students (Old),Get  Students List in Canvas LMS,{}
Canvas LMS,https://www.workato.com/integrations/canvas-lms,action,Get Sections,Get  Sections in Canvas LMS,{}
Canvas LMS,https://www.workato.com/integrations/canvas-lms,action,Get Submissions,Get  Submissions in Canvas LMS,{}
Capsule CRM,https://www.workato.com/integrations/capsule-crm,trigger,New event,New  event in Capsule CRM,"{""badge"": ""Real-time""}"
Capsule CRM,https://www.workato.com/integrations/capsule-crm,trigger,New record,New record in Capsule CRM.,{}
Capsule CRM,https://www.workato.com/integrations/capsule-crm,action,Custom action,Custom action in Capsule CRM (Custom),{}
Capsule CRM,https://www.workato.com/integrations/capsule-crm,action,Create record,Create record in Capsule CRM,{}
Capsule CRM,https://www.workato.com/integrations/capsule-crm,action,Get record details by ID,Get record by ID in Capsule CRM,{}
Capsule CRM,https://www.workato.com/integrations/capsule-crm,action,Search records,Search records in Capsule CRM,{}
Capsule CRM,https://www.workato.com/integrations/capsule-crm,action,Update record,Update record in Capsule CRM,{}
Casavi,https://www.workato.com/integrations/casavi,trigger,New events,New events in Casavi,"{""badge"": ""Real-time""}"
Casavi,https://www.workato.com/integrations/casavi,trigger,New or updated trigger,New or updated trigger in Casavi,{}
